[
  {
    "id": "evidence-0001",
    "type": "correspondence",
    "source": "FINRA and NASDAQ enforcement action against Scout Trading, LLC",
    "date": "2015",
    "excerpt": "Scout Trading, LLC, a proprietary trading firm that would be fined $3 million by FINRA and NASDAQ in 2015 for a systematic naked short-selling scheme involving 255 illegal redemption orders across 14 leveraged ETFs, totaling more than 295 million shares",
    "full_reference": "Line 81",
    "proceeding_ids": [],
    "related_claim_ids": [
      "claim-0110",
      "claim-0113"
    ],
    "related_event_ids": [],
    "provenance": "INTRODUCTION: THE TOWNHOUSE ON HARRISON STREET | Line 81",
    "reliability_level": "secondary_reference",
    "notes_internal": null
  },
  {
    "id": "evidence-0002",
    "type": "correspondence",
    "source": "300 documented water failure points in 13 Harrison Street",
    "date": null,
    "excerpt": "Water pours through 299 documented failure points",
    "full_reference": "Line 69",
    "proceeding_ids": [],
    "related_claim_ids": [],
    "related_event_ids": [],
    "provenance": "VII. The Connection Between Past and Present | Line 69",
    "reliability_level": "secondary_reference",
    "notes_internal": null
  },
  {
    "id": "evidence-0003",
    "type": "correspondence",
    "source": "Certificate of Occupancy for 13 Harrison Street, Unit 1 restrictions",
    "date": "1995",
    "excerpt": "the building's Certificate of Occupancy (C of O No. 107294, issued 1995) restricts to 'Recreation Room, Tenant Storage, Meters'",
    "full_reference": "Line 77",
    "proceeding_ids": [],
    "related_claim_ids": [
      "claim-0003",
      "claim-0059",
      "claim-0068",
      "claim-0070",
      "claim-0071",
      "claim-0167",
      "claim-0211"
    ],
    "related_event_ids": [
      "event-0023",
      "event-0024"
    ],
    "provenance": "INTRODUCTION: THE TOWNHOUSE ON HARRISON STREET | Line 77",
    "reliability_level": "secondary_reference",
    "notes_internal": null
  },
  {
    "id": "evidence-0004",
    "type": "correspondence",
    "source": "Independent appraiser valuation of Unit 1",
    "date": null,
    "excerpt": "an independent appraiser valued at $2.5 million",
    "full_reference": "Line 69",
    "proceeding_ids": [],
    "related_claim_ids": [
      "claim-0006"
    ],
    "related_event_ids": [
      "event-0044",
      "event-0096"
    ],
    "provenance": "VII. The Connection Between Past and Present | Line 69",
    "reliability_level": "secondary_reference",
    "notes_internal": null
  },
  {
    "id": "evidence-0005",
    "type": "correspondence",
    "source": "Brown Harris Stevens listing for 13 Harrison Street combined units",
    "date": "2017",
    "excerpt": "The listing, handled by David Kornmeier of Brown Harris Stevens—the same broker who would later become a key deposition witness in the Bleich litigation—described the property as a 'five-story, loft-style residence' boasting 'seven bedrooms, ten bathrooms, an elevator, three wood-burning fireplaces, three laundry facilities, large skylights, and a lovely solarium'",
    "full_reference": "Line 25",
    "proceeding_ids": [],
    "related_claim_ids": [],
    "related_event_ids": [],
    "provenance": "III. The $25 Million Listing: 2017 | Line 25",
    "reliability_level": "secondary_reference",
    "notes_internal": null
  },
  {
    "id": "evidence-0006",
    "type": "correspondence",
    "source": "Board Minutes of October 15, 2018",
    "date": "October 15, 2018; sent October 16, 2018",
    "excerpt": "Minutes recording election of Morgan Brill and Michael Bleich as co-Presidents; Alexis Bleich as Secretary; Michael and Alexis Bleich as Resident Managers; tabling of budget and operations items.",
    "full_reference": "Chapter One, paragraph 5",
    "proceeding_ids": [],
    "related_claim_ids": [
      "claim-0011",
      "claim-0012",
      "claim-0013",
      "claim-0014",
      "claim-0043",
      "claim-0137"
    ],
    "related_event_ids": [
      "event-0021"
    ],
    "provenance": "II. The October 15, 2018 'Board Meeting': A Fabrication | Chapter One, paragraph 5",
    "reliability_level": "secondary_reference",
    "notes_internal": null
  },
  {
    "id": "evidence-0007",
    "type": "correspondence",
    "source": "ROFR Waiver Certificate No. 1",
    "date": "October 17, 2018",
    "excerpt": "Certificate purporting to waive the ROFR as to Morgan Brill's sale of Unit 2 to 13 Harrison LLC; signed by Michael Bleich as 'Co-President and Manager' and Alexis Bleich as 'Secretary and Manager.'",
    "full_reference": "Chapter One, paragraph 6",
    "proceeding_ids": [],
    "related_claim_ids": [],
    "related_event_ids": [
      "event-0023",
      "event-0024"
    ],
    "provenance": "II. The October 15, 2018 'Board Meeting': A Fabrication | Chapter One, paragraph 6",
    "reliability_level": "secondary_reference",
    "notes_internal": null
  },
  {
    "id": "evidence-0008",
    "type": "correspondence",
    "source": "ROFR Waiver Certificate No. 2 (Blanket Waiver)",
    "date": "October 17, 2018",
    "excerpt": "Certificate purporting to waive the ROFR as to sales of all units from October 17, 2018 through December 31, 2019; signed by Michael Bleich as 'Co-President and Manager' and Alexis Bleich as 'Secretary and Manager.'",
    "full_reference": "Chapter One, paragraph 6",
    "proceeding_ids": [],
    "related_claim_ids": [],
    "related_event_ids": [
      "event-0023",
      "event-0024"
    ],
    "provenance": "II. The October 15, 2018 'Board Meeting': A Fabrication | Chapter One, paragraph 6",
    "reliability_level": "secondary_reference",
    "notes_internal": null
  },
  {
    "id": "evidence-0009",
    "type": "correspondence",
    "source": "Morgan Brill Resignation Email",
    "date": "October 19, 2018",
    "excerpt": "Hi Mike, Alexis and Arnulf. I am just emailing to let you know that as of yesterday I am officially resigning as Co-President of the board of 13 Harrison St, and here I am connecting you folks so you can all get in touch and move forward with a new meeting or whatever you need to do! Thanks & have a great weekend.",
    "full_reference": "Chapter One, paragraph 18",
    "proceeding_ids": [],
    "related_claim_ids": [],
    "related_event_ids": [
      "event-0027",
      "event-0028",
      "event-0032",
      "event-0036",
      "event-0037",
      "event-0038",
      "event-0041",
      "event-0057",
      "event-0059",
      "event-0075",
      "event-0085",
      "event-0140"
    ],
    "provenance": "IV. The Resignation Sequence: Timing Is Everything | Chapter One, paragraph 18",
    "reliability_level": "secondary_reference",
    "notes_internal": null
  },
  {
    "id": "evidence-0010",
    "type": "correspondence",
    "source": "Morgan Brill September 2024 Correspondence",
    "date": "September 3, 2024",
    "excerpt": "Multiple statements regarding October 15 board meeting, ROFR waiver, relationship with Bleich, revenue sharing agreements, and HVAC equipment history.",
    "full_reference": "Chapter One, paragraphs 9, 10, 12-15",
    "proceeding_ids": [],
    "related_claim_ids": [
      "claim-0019",
      "claim-0020",
      "claim-0021",
      "claim-0022",
      "claim-0023",
      "claim-0024",
      "claim-0025",
      "claim-0026",
      "claim-0027",
      "claim-0028",
      "claim-0029",
      "claim-0030",
      "claim-0031",
      "claim-0032"
    ],
    "related_event_ids": [],
    "provenance": "III. Morgan Brill's Testimony: 'We Never Had an In-Person Board Meeting' | Chapter One, paragraphs 9, 10, 12-15",
    "reliability_level": "secondary_reference",
    "notes_internal": null
  },
  {
    "id": "evidence-0011",
    "type": "correspondence",
    "source": "Michael Bleich Welcome Email",
    "date": "October 21, 2018",
    "excerpt": "Hi Arnulf, Welcome to the building. Regards, Mike.",
    "full_reference": "Chapter One, paragraph 26",
    "proceeding_ids": [],
    "related_claim_ids": [],
    "related_event_ids": [
      "event-0027",
      "event-0028",
      "event-0032",
      "event-0036",
      "event-0037",
      "event-0038",
      "event-0041",
      "event-0057",
      "event-0059",
      "event-0075",
      "event-0085",
      "event-0140"
    ],
    "provenance": "V. The Hostile Takeover: November–December 2018 | Chapter One, paragraph 26",
    "reliability_level": "secondary_reference",
    "notes_internal": null
  },
  {
    "id": "evidence-0012",
    "type": "correspondence",
    "source": "Unit 2 Owner Meeting Proposal Email",
    "date": "October 30, 2018",
    "excerpt": "I would like to suggest a personal meeting (to put a face to the email), as I now joined you as an 'officially' unit owner and address a few administrative things since Morgan left. He proposes November 7 or 8 and suggests breakfast at Sarabeth's.",
    "full_reference": "Chapter One, paragraph 26",
    "proceeding_ids": [],
    "related_claim_ids": [
      "claim-0131"
    ],
    "related_event_ids": [
      "event-0027",
      "event-0028",
      "event-0032",
      "event-0036",
      "event-0037",
      "event-0038",
      "event-0041",
      "event-0057",
      "event-0059",
      "event-0075",
      "event-0085",
      "event-0140"
    ],
    "provenance": "V. The Hostile Takeover: November–December 2018 | Chapter One, paragraph 26",
    "reliability_level": "secondary_reference",
    "notes_internal": null
  },
  {
    "id": "evidence-0013",
    "type": "correspondence",
    "source": "Michael Bleich Meeting Confirmation Email",
    "date": "November 1, 2018",
    "excerpt": "I don't have anything pressing to discuss prior to our meeting.",
    "full_reference": "Chapter One, paragraph 27",
    "proceeding_ids": [],
    "related_claim_ids": [],
    "related_event_ids": [
      "event-0027",
      "event-0028",
      "event-0032",
      "event-0036",
      "event-0037",
      "event-0038",
      "event-0041",
      "event-0057",